{
  "schemaVersion": "1.0",
  "contentVersion": "1.1.0",
  "updatedAt": "2026-08-31",
  "songs": [
    {
      "id": "gospel-001",
      "number": 1,
      "title": "Amazing Grace",
      "content": {
        "sections": [
          {
            "type": "verse",
            "label": "Verse 1",
            "lines": [
              "Amazing grace! how sweet the sound,",
              "That saved a wretch like me!",
              "I once was lost, but now am found,",
              "Was blind, but now I see."
            ]
          },
          {
            "type": "verse",
            "label": "Verse 2",
            "lines": [
              "’Twas grace that taught my heart to fear,",
              "And grace my fears relieved;",
              "How precious did that grace appear",
              "The hour I first believed."
            ]
          }
        ]
      },
      "search": {
        "keywords": ["grace", "faith", "public domain"]
      },
      "verification": {
        "status": "verified",
        "source": "Public domain, John Newton (1779)",
        "note": "Public-domain text."
      }
    },
    {
      "id": "gospel-002",
      "number": 2,
      "title": "Holy, Holy, Holy",
      "content": {
        "sections": [
          {
            "type": "verse",
            "label": "Verse 1",
            "lines": [
              "Holy, holy, holy! Lord God Almighty!",
              "Early in the morning our song shall rise to thee;",
              "Holy, holy, holy! merciful and mighty,",
              "God in three persons, blessed Trinity!"
            ]
          },
          {
            "type": "verse",
            "label": "Verse 2",
            "lines": [
              "Holy, holy, holy! all the saints adore thee,",
              "Casting down their golden crowns around the glassy sea;",
              "Cherubim and seraphim falling down before thee,",
              "Which wert, and art, and evermore shalt be."
            ]
          }
        ]
      },
      "search": {
        "keywords": ["worship", "trinity", "public domain"]
      },
      "verification": {
        "status": "verified",
        "source": "Public domain, Reginald Heber (1826)",
        "note": "Public-domain text."
      }
    }
  ]
}
